id,name,slug,domain_id,summary
cluster-1,Acoustic And Passive Sensing,acoustic-and-passive-sensing,domain-2,Passive acoustic and RF sensing systems for persistent monitoring where active emissions or crewed patrols are weak
cluster-2,Radar And Overhead Monitoring,radar-and-overhead-monitoring,domain-2,Radar satellite and EO watch systems that support corridor monitoring route awareness and local site watch
cluster-3,Maritime Autonomous Platforms,maritime-autonomous-platforms,domain-1,Autonomous maritime patrol systems and payloads used for subsea and coastal operations
cluster-4,Over-Snow Autonomous Systems,over-snow-autonomous-systems,domain-3,Ground robotics and temporary survey systems for austere route reconnaissance and short campaign coverage
cluster-5,Edge Fusion And Mission Software,edge-fusion-and-mission-software,domain-4,Software and analytics layers that fuse signals triage anomalies and keep decisions local when backhaul is weak
cluster-6,Relay And Expeditionary Communications,relay-and-expeditionary-communications,domain-5,Relay nodes mesh radios and bandwidth control systems that extend local connectivity across sparse sites
cluster-7,Remote Power And Sustainment,remote-power-and-sustainment,domain-5,Power recovery and sustainment systems that keep distributed unmanned and sensing assets operating in low-support environments
