id,source_id,capability_id,excerpt
snippet-1,source-1,capability-1,The listening array maintained continuous maritime coverage through six weeks of winter operation
snippet-2,source-2,capability-2,The relay buoy extended network reach without requiring crewed support at the edge
snippet-3,source-3,capability-3,The edge grid fused sparse sensor feeds into a single operator-ready picture
snippet-4,source-4,capability-4,The update prioritizes critical traffic when available bandwidth becomes constrained
snippet-5,source-5,capability-5,Winter propulsion results support further Arctic patrol validation but not full deployment claims
snippet-6,source-6,capability-6,The mapper payload added ice edge and subsea context during the maritime exercise
snippet-7,source-7,capability-7,Operators used the software to flag unusual patterns across vessel and sensor traffic
snippet-8,source-8,capability-8,The shoreline radar pilot improved watch coverage across a northern coastal approach
snippet-9,source-9,capability-9,Forecast outputs highlighted short-horizon ice movement relevant to route decisions
snippet-10,source-10,capability-10,The relay node carried sensor traffic across a long remote coastal corridor
snippet-11,source-11,capability-11,The change lens surfaced meaningful ice and infrastructure movement from SAR collections
snippet-12,source-12,capability-12,The mobility program selected the vehicle for cold-environment field testing rather than deployment
snippet-13,source-13,capability-13,The sensor sled was deployed quickly to establish temporary route survey coverage
snippet-14,source-14,capability-14,The passive RF network detected emitters across remote maritime approaches without broadcasting
snippet-15,source-15,capability-15,The mission stack kept local applications available despite intermittent cloud connectivity
snippet-16,source-16,capability-16,The docking pod passed environmental checks but still requires operational endurance testing
snippet-17,source-17,capability-17,The service gave planners repeatable route risk and vessel movement awareness
snippet-18,source-18,capability-18,The EO mast supported wide-area watch at a temporary northern observation site
snippet-19,source-19,capability-19,The microgrid kit powered remote sensing and relay hardware through multi-day winter testing
snippet-20,source-20,capability-20,The mesh radio maintained local connectivity for sensors and operators at a temporary Arctic site
